{
 "environment_parity": {
  "db_version": "recorded per result row at trial time for database_migration tasks",
  "go_version": "recorded per result row at trial time",
  "model": "identical model id for every trial participant; observed model recorded per result row, never the requested profile alone",
  "os": "recorded per result row at trial time",
  "repo_baseline": "every trial participant starts from the same fixture file set pinned per task below; the pinned fixture hashes are the baseline identity",
  "runtime": "identical coding runtime, adapter and CLI versions for every trial participant; observed identity recorded per task result row (Decision Lock 15)"
 },
 "frozen_at": "2026-09-09T00:00:00Z",
 "manifest_version": 1,
 "tasks": [
  {
   "acceptance_frozen": "01c4964df5ce8b50856ed4fc937456a4cbe6b17dcff620a9f137c27ca3e55d66",
   "difficulty": "S",
   "fixture_hashes": {
    "test/eval/v14_product/testdata/tasks/bf-01-token-bucket-offbyone/acceptance.yaml": "01c4964df5ce8b50856ed4fc937456a4cbe6b17dcff620a9f137c27ca3e55d66",
    "test/eval/v14_product/testdata/tasks/bf-01-token-bucket-offbyone/baseline/token_bucket.go": "d4b569a436071926c2986b3017e8a55bd576486de1a0e2c7e46eff53888932d4",
    "test/eval/v14_product/testdata/tasks/bf-01-token-bucket-offbyone/intent.md": "65198c2e96ad4d8df88129fef1e5b89808ed460a23b77014685c17acbb7a3d60",
    "test/eval/v14_product/testdata/tasks/bf-01-token-bucket-offbyone/oracle/oracle.json": "197e8044ef817acd470e5dfa333fc292f673d6a038747589878c94adc7cc7996",
    "test/fixtures/v14/bugfix/contracts/TASK-2410.yaml": "8a7fd548343b20d8a06d4cbc890d19cf931462173f016775f865e34aa9111b2d",
    "test/fixtures/v14/bugfix/facts/TASK-2410.yaml": "400eb7fb4649d91ba27ac15bb133a7512dd0404e4ccc0b1e48773606d41fe992"
   },
   "harness": "bug_fix",
   "inclusion_rationale": "Boundary defect from the real bug-fix harness corpus (TASK-2410 token bucket); deterministic single-point regression with a reproducible failing baseline.",
   "intent_text_sha256": "65198c2e96ad4d8df88129fef1e5b89808ed460a23b77014685c17acbb7a3d60",
   "task_id": "bf-01-token-bucket-offbyone"
  },
  {
   "acceptance_frozen": "97a5cf524e0c56ff9b2db10cd8b8e213df2268cfa8464ede3911027929d76cb1",
   "difficulty": "L",
   "fixture_hashes": {
    "test/eval/v14_product/testdata/tasks/bf-02-logout-session-invalidation/acceptance.yaml": "97a5cf524e0c56ff9b2db10cd8b8e213df2268cfa8464ede3911027929d76cb1",
    "test/eval/v14_product/testdata/tasks/bf-02-logout-session-invalidation/baseline/session_store.go": "daa9b1dc3172873f05010f6b0bd8653db4c203ca3b49e56bf5bc31c79286f218",
    "test/eval/v14_product/testdata/tasks/bf-02-logout-session-invalidation/intent.md": "12c6ee9bc30ee23c4a00985c244d3f94be6893ad980a5b6619eae3b1df31e38f",
    "test/eval/v14_product/testdata/tasks/bf-02-logout-session-invalidation/oracle/oracle.json": "661a48f44320ee51d2337c654a8108eb95da858ecb9bb1d498128714945fc5d8",
    "test/fixtures/v14/bugfix/contracts/TASK-2411.yaml": "09f9f3c60966b5f146be2eb82d5d1cfc41fdb0d657049acf65cb98241d078f4e",
    "test/fixtures/v14/bugfix/facts/TASK-2411.yaml": "176413740091cfb96eccadbcaf587eff6a51a2601eb17ca23bbe1a0c003e96f0"
   },
   "harness": "bug_fix",
   "inclusion_rationale": "Auth-surface defect from the bug-fix harness corpus (TASK-2411 session invalidation); exercises sequence semantics and source-independent regression evidence.",
   "intent_text_sha256": "12c6ee9bc30ee23c4a00985c244d3f94be6893ad980a5b6619eae3b1df31e38f",
   "task_id": "bf-02-logout-session-invalidation"
  },
  {
   "acceptance_frozen": "ec60a51a0f91111ed1ed4073de372ae02c7e14d7b593525b26a7c8379904f194",
   "difficulty": "M",
   "fixture_hashes": {
    "test/eval/v14_product/testdata/tasks/bf-03-pagination-partial-page/acceptance.yaml": "ec60a51a0f91111ed1ed4073de372ae02c7e14d7b593525b26a7c8379904f194",
    "test/eval/v14_product/testdata/tasks/bf-03-pagination-partial-page/baseline/pagination.go": "9171a2b54c1189d493cf3ecbe9842d966b49e5efa53dceb01703062e63d592c1",
    "test/eval/v14_product/testdata/tasks/bf-03-pagination-partial-page/intent.md": "c1e3900fd9cdadd240284ff83dfd844dc5fc3879158ea22ebf2dacbd1294d909",
    "test/eval/v14_product/testdata/tasks/bf-03-pagination-partial-page/oracle/oracle.json": "56fc6d1719ee119de99d3ce8b730600552916d196e249c9686788a54f26860dd"
   },
   "harness": "bug_fix",
   "inclusion_rationale": "Representative page-accounting off-by-one; partial-page reasoning must hold across several oracle cases at realistic scale.",
   "intent_text_sha256": "c1e3900fd9cdadd240284ff83dfd844dc5fc3879158ea22ebf2dacbd1294d909",
   "task_id": "bf-03-pagination-partial-page"
  },
  {
   "acceptance_frozen": "728bba4f1d9caa269bcc97fb3c58be542236ec4e8dce2f11c768060b6385377f",
   "difficulty": "M",
   "fixture_hashes": {
    "test/eval/v14_product/testdata/tasks/bf-04-date-validation-calendar/acceptance.yaml": "728bba4f1d9caa269bcc97fb3c58be542236ec4e8dce2f11c768060b6385377f",
    "test/eval/v14_product/testdata/tasks/bf-04-date-validation-calendar/baseline/datevalidate.go": "dbd3e9dd6c761b235fdb20bc8c0185fefb906d79a6f6bb35cc3705bdce1a395d",
    "test/eval/v14_product/testdata/tasks/bf-04-date-validation-calendar/intent.md": "32fe092dbfd3576d5d8ca172125b8cddde126132f6a81df8c84740e1b11493fe",
    "test/eval/v14_product/testdata/tasks/bf-04-date-validation-calendar/oracle/oracle.json": "a22d4c75689d686deadeebd6587e47af79f3aca7688a5f22002857254f91ef85"
   },
   "harness": "bug_fix",
   "inclusion_rationale": "Calendar validation matrix defect; exercises rule completeness (month lengths, leap centuries, strict formatting) without any infrastructure.",
   "intent_text_sha256": "32fe092dbfd3576d5d8ca172125b8cddde126132f6a81df8c84740e1b11493fe",
   "task_id": "bf-04-date-validation-calendar"
  },
  {
   "acceptance_frozen": "2698e1d58dd7012a6a99241d8be13f7f45c0c6a5df084e1bee6c7461b1abbe8d",
   "difficulty": "M",
   "fixture_hashes": {
    "test/eval/v14_product/testdata/tasks/bf-05-currency-rounding-halfup/acceptance.yaml": "2698e1d58dd7012a6a99241d8be13f7f45c0c6a5df084e1bee6c7461b1abbe8d",
    "test/eval/v14_product/testdata/tasks/bf-05-currency-rounding-halfup/baseline/currency.go": "aeec1daac3818b8641877fc2c90a0e38bc2c8f4bf068bfa8b11f2d022486336b",
    "test/eval/v14_product/testdata/tasks/bf-05-currency-rounding-halfup/intent.md": "6f63021ededebfe1e5cb7236bf2233671abc61e6073a174cc5f7244f3339da3f",
    "test/eval/v14_product/testdata/tasks/bf-05-currency-rounding-halfup/oracle/oracle.json": "caf9dbee1f4e4d4cbb37ec5157a0d48817ca53499ac943092d85e791fe9988ea"
   },
   "harness": "bug_fix",
   "inclusion_rationale": "Numeric rounding defect with sign symmetry; representative billing-precision regression that silently loses fractions of a cent.",
   "intent_text_sha256": "6f63021ededebfe1e5cb7236bf2233671abc61e6073a174cc5f7244f3339da3f",
   "task_id": "bf-05-currency-rounding-halfup"
  },
  {
   "acceptance_frozen": "eb6698b99b89917822d6b5b4de1ad7ca63819ba62275142c3b735c124de4194e",
   "difficulty": "S",
   "fixture_hashes": {
    "test/eval/v14_product/testdata/tasks/bf-06-email-dedupe-casefold/acceptance.yaml": "eb6698b99b89917822d6b5b4de1ad7ca63819ba62275142c3b735c124de4194e",
    "test/eval/v14_product/testdata/tasks/bf-06-email-dedupe-casefold/baseline/emails.go": "a710b9d41ea93fc5efe5c7bca605b6f1ca8d17db893d1a8bf6040259a132024c",
    "test/eval/v14_product/testdata/tasks/bf-06-email-dedupe-casefold/intent.md": "e455c294414d6e8bf0b1b688ab14b994c75093622802b78ab8ad4feb77446440",
    "test/eval/v14_product/testdata/tasks/bf-06-email-dedupe-casefold/oracle/oracle.json": "b0fac71afd6c9f758a2e7d25db0ebabfa9fda15a4947d8d974332e51aeefaaf3"
   },
   "harness": "bug_fix",
   "inclusion_rationale": "Case-sensitivity dedupe defect; representative normalization regression with a deterministic total order on the output.",
   "intent_text_sha256": "e455c294414d6e8bf0b1b688ab14b994c75093622802b78ab8ad4feb77446440",
   "task_id": "bf-06-email-dedupe-casefold"
  },
  {
   "acceptance_frozen": "1e71e0f8c09b8c5fb24f1de13c81af1fc973999e21394256071fc5856389dd34",
   "difficulty": "M",
   "fixture_hashes": {
    "test/eval/v14_product/testdata/tasks/db-01-orders-total-backfill/acceptance.yaml": "1e71e0f8c09b8c5fb24f1de13c81af1fc973999e21394256071fc5856389dd34",
    "test/eval/v14_product/testdata/tasks/db-01-orders-total-backfill/intent.md": "0e0ed3a44fa95cc604d114a7ab8c662d45053ce483be28701292ae509ae17aec",
    "test/eval/v14_product/testdata/tasks/db-01-orders-total-backfill/oracle/oracle.json": "ca0f32bb5c93a7e6c075de91aada6b00e273ec5e5962ec545ffdbcecb0d53e22",
    "test/fixtures/v14/migration/migrations/0001_init.sql": "8dcfc0991f5ba3cfaff0337ae89f6a51893956722b5751ea26965c4e966468fd",
    "test/fixtures/v14/migration/migrations/0002_add_orders.sql": "7854995d166c0c83a56b84fe0462ff690b0f3b7fa039ad2c2f2c4c8906917dd1",
    "test/fixtures/v14/migration/migrations/0003_orders_total_not_null.sql": "f5018fe85e43a40261472a9b489ba0a4f91b15a256891c0bcf7053f883662a85",
    "test/fixtures/v14/migration/repair/0003_orders_total_not_null.sql": "64b94606650c06a4c509e157faeb15058ccc3f235258ca8ec27b586fbca0495a",
    "test/fixtures/v14/migration/seed/n_minus_1.sql": "f49e6d3f236f4b49bf5c88cc237fa8b63c946b94ad77e78e98e9bb7ee111b2f3"
   },
   "harness": "database_migration",
   "inclusion_rationale": "Materializes the P3-02 migration corpus (orders.total_cents NOT NULL without DEFAULT); the canonical fresh-versus-upgraded false-confidence scenario, pinned to the existing test/fixtures/v14/migration files.",
   "intent_text_sha256": "0e0ed3a44fa95cc604d114a7ab8c662d45053ce483be28701292ae509ae17aec",
   "task_id": "db-01-orders-total-backfill"
  },
  {
   "acceptance_frozen": "7829428d4d7483b88b879925591b29fb324d5ec2c50e066dc7d6b48233900278",
   "difficulty": "M",
   "fixture_hashes": {
    "test/eval/v14_product/testdata/tasks/db-02-account-email-unique/acceptance.yaml": "7829428d4d7483b88b879925591b29fb324d5ec2c50e066dc7d6b48233900278",